Tab,team_id,fa_id,player_id,player_name,team_name,division,role_code,primary_type,secondary_type,secondary_type_friendly,mobility_traits,description,power_rating,INT,STR,SPD,DUR,EP,FS,LDR,RES,WIL,LCK,ESP,OP,AM,SBY,Archetype,Tags,photo_path,active
Master_Roster,T005,F144,P144,Taskmaster,Ligmasigma II,Undercurrent,"RG, VG, GO",Mystic Adept (MA),weapons_expert,Weapons Expert,GRD,grounded,5.82,3,3,2,3,1,7,6,5,5,5,6,3,7,6,Cynic,"photographic_reflexes, mercenary, mimic, street_level, shield_affiliated",https://res.cloudinary.com/dvncqcife/image/upload/v1741318303/Taskmaster_hp7xvt.png,TRUE
Master_Roster,Free Agent,F145,P145,Temper,unaffiliated,unaffiliated,"RG, VG",Mystic Adept (MA),mystic_practitioner,Mystic Arts Practitioner,HVR,hover,4.04,2,2,2,2,4,3,4,4,4,4,4,5,5,5,Rebel,"rage_state, emotion_drive, strength_based, unknown_origin, wildcard",https://res.cloudinary.com/dvncqcife/image/upload/v1741318304/Tempur_agevgg.png,TRUE
Master_Roster,T004,F146,P146,Tempus,Dumb and Dumber Returns,Undercurrent,"RG, PO, SV",Cosmic & Reality (CR),dimensional_manipulator,Dimensional Manipulator,"HVR, TP","hover, teleport",4.58,2,2,2,2,5,2,5,4,4,4,5,6,5,5,Mystic,"time_control, mutant, strategic, x-men_affiliated, future_bender",https://res.cloudinary.com/dvncqcife/image/upload/v1741318305/Tempus_esnlxw.png,TRUE
Master_Roster,T007,F147,P147,The Human Torch,Agents of Vishanti,Overlay,"RG, VG, EN",Physical Combatants (PC),cosmic_entity,Cosmic Entity,"FLY, HVR","fly, hover",6.12,2,2,5,3,6,3,5,5,6,5,4,7,5,5,Rebel,"fire_user, impulsive, fantastic_four_affiliated, aerial, team_player",https://res.cloudinary.com/dvncqcife/image/upload/v1741318307/The_Human_Torch_erbv6v.png,TRUE
Master_Roster,Free Agent,F148,P148,The Lizard,unaffiliated,unaffiliated,"RG, VG, GO",Physical Combatants (PC),unorthodox_fighter,Unorthodox Fighter,GRD,grounded,3.57,5,5,3,4,1,3,4,5,5,5,4,3,4,4,Villainous Pragmatist,"scientist, transformation, reptile, spider-man_affiliated, brute",https://res.cloudinary.com/dvncqcife/image/upload/v1741318308/The_Lizard_cndaiq.png,TRUE
Master_Roster,T004,F149,P149,The Thing,Dumb and Dumber Returns,Undercurrent,"RG, VG, EN",Physical Combatants (PC),tank,Tank,GRD,grounded,4.74,2,6,2,6,1,4,5,6,4,6,2,3,5,6,Idealist,"tank, strength_based, fantastic_four_affiliated, loyalist, brute",https://res.cloudinary.com/dvncqcife/image/upload/v1741318309/The_Thing_kchqjt.png,TRUE
Master_Roster,T002,F150,P150,The Wasp,Costco Wholesale,Overlay,"FL, RG, VG, GO",Technological & Cybernetic (TC),gadget_specialist,Gadget Specialist,"FLY, HVR","fly, hover",4.86,3,2,2,2,5,4,5,4,5,4,6,5,5,5,Strategist,"size_shifting, scientist, leader, avengers_affiliated, aerial",https://res.cloudinary.com/dvncqcife/image/upload/v1741318309/The_Wasp_ikquyx.png,TRUE
Master_Roster,T008,F151,P151,Thor (Jane Foster),Slow And Threatening,Undercurrent,"FL, RG, VG, EN, SV",Cosmic & Reality (CR),tank,Tank,"FLY, HVR","fly, hover",9.38,3,7,7,6,6,4,6,7,7,6,2,7,6,6,Idealist,"thunder_user, divine_power, mjolnir_wielder, avengers_affiliated, legacy",https://res.cloudinary.com/dvncqcife/image/upload/v1741318311/Thor_Jane_Foster_svqy2j.png,TRUE
Master_Roster,T006,F152,P152,Thor,Pigeon Desk,Overlay,"FL, RG, VG, EN, SV",Cosmic & Reality (CR),tank,Tank,"FLY, HVR","fly, hover",9.40,2,7,7,6,6,4,6,7,7,4,2,7,6,7,Guardian,"thunder_user, god, asgardian, mjolnir_wielder, avengers_affiliated",https://res.cloudinary.com/dvncqcife/image/upload/v1741318312/Thor_v7dyvj.png,TRUE
Master_Roster,Free Agent,F153,P153,U.S. Agent,unaffiliated,unaffiliated,"FL, RG, VG",Physical Combatants (PC),brawler,Brawler,GRD,grounded,4.70,2,4,2,4,1,6,5,5,5,5,5,3,5,6,Cynic,"government_agent, aggressive, super_soldier, shield_affiliated, antihero",https://res.cloudinary.com/dvncqcife/image/upload/v1741318314/U.S._Agent_kdhivp.png,TRUE
Master_Roster,T008,F154,P154,Ultron,Slow And Threatening,Undercurrent,"FL, RG, VG, EN, PO, GO, SV",Technological & Cybernetic (TC),cybernetic_augmentee,Cybernetic Augmentee,"FLY, HVR","fly, hover",9.21,6,6,3,7,6,3,7,7,6,7,1,7,6,6,Villainous Pragmatist,"ai, villain, evolution, mass_murderer, avengers_antagonist",https://res.cloudinary.com/dvncqcife/image/upload/v1741318315/Ultron_ptcnsi.png,TRUE
Master_Roster,T009,F155,P155,Valkyrie,Amber,Undercurrent,"RG, EN",Mystic Adept (MA),monster_hunter,Monster Hunter,"FLY, HVR","fly, hover",5.51,2,6,2,6,1,6,5,6,5,6,2,4,5,6,Rebel,"asgardian, sword_user, divine_guardian, aerial, protector",https://res.cloudinary.com/dvncqcife/image/upload/v1741318316/Valkyrie_yzesrp.png,TRUE
Master_Roster,T001,F156,P156,Venom,Gambit Is A Pretty Pretty Princess,Undercurrent,"RG, VG, GO",Physical Combatants (PC),brawler,Brawler,HVR,hover,4.29,2,4,3,4,1,4,5,6,5,6,4,4,5,4,Outsider,"symbiote, street_level, antihero, spider-man_affiliated, rage_state",https://res.cloudinary.com/dvncqcife/image/upload/v1741318317/Venom_kzevm3.png,TRUE
Master_Roster,T008,F157,P157,Vision,Slow And Threatening,Undercurrent,"RG, VG, EN, PO, GO, SV",Technological & Cybernetic (TC),cybernetic_augmentee,Cybernetic Augmentee,"FLY, HVR","fly, hover",8.84,5,5,5,6,5,3,6,6,6,6,5,7,5,7,Cosmic Observer,"synthetic_life, strategist, density_control, avengers_affiliated, introspective",https://res.cloudinary.com/dvncqcife/image/upload/v1741318318/Vision_ehxmmp.png,TRUE
Master_Roster,T008,F158,P158,War Machine,Slow And Threatening,Undercurrent,"FL, RG, VG, EN",Technological & Cybernetic (TC),armor_powered_hero,Armor-Powered Hero,"FLY, HVR","fly, hover",7.02,3,5,3,6,5,4,5,6,5,6,5,6,5,6,Strategist,"tech_armor, heavy_weapons, military, avengers_affiliated, aerial",https://res.cloudinary.com/dvncqcife/image/upload/v1741318319/War_Machine_isvhln.png,TRUE
Master_Roster,T008,F159,P159,Warlock,Slow And Threatening,Undercurrent,"RG, VG, PO, GO, SV",Cosmic & Reality (CR),unorthodox_fighter,Unorthodox Fighter,"FLY, HVR","fly, hover",6.98,3,4,5,6,6,3,5,5,5,5,1,7,6,5,Mystic,"techno_organic, shapeshifter, alien, new_mutants_affiliated, empathetic",https://res.cloudinary.com/dvncqcife/image/upload/v1743285635/Warlock_iaxazg.png,TRUE
Master_Roster,T002,F160,P160,Wiccan,Costco Wholesale,Overlay,"VG, EN, PO, SV",Mystic Adept (MA),cosmic_entity,Cosmic Entity,"FLY, HVR, TP","fly, hover, teleport",5.98,3,2,2,2,7,2,5,5,5,5,4,7,6,5,Mystic,"magic, reality_warping, chaos_magic, young_avengers_affiliated, lgbtq_representative",https://res.cloudinary.com/dvncqcife/image/upload/v1741318321/Wiccan_edmwpq.png,TRUE
Master_Roster,Free Agent,F161,P161,Winter Soldier,unaffiliated,unaffiliated,"FL, RG, VG, EN, GO",Physical Combatants (PC),mystic_practitioner,Mystic Arts Practitioner,GRD,grounded,4.72,3,3,2,3,1,6,5,5,5,5,6,3,6,5,Cynic,"spy, cybernetic_arm, redemption_arc, shield_affiliated, trauma_survivor",https://res.cloudinary.com/dvncqcife/image/upload/v1741318323/Winter_Soldier_tkbgk1.png,TRUE
Master_Roster,Free Agent,F162,P162,Wolfsbane,unaffiliated,unaffiliated,"RG, VG",Physical Combatants (PC),weapons_expert,Weapons Expert,GRD,grounded,3.97,2,4,3,3,1,4,4,5,5,5,5,3,5,5,Guardian,"shapeshifter, wolf_form, religious_conflict, x-men_affiliated, legacy",https://res.cloudinary.com/dvncqcife/image/upload/v1741318324/Wolfbane_ipfqvp.png,TRUE
Master_Roster,T007,F163,P163,Wolverine / X-23,Agents of Vishanti,Overlay,"RG, VG, GO",Physical Combatants (PC),unorthodox_fighter,Unorthodox Fighter,GRD,grounded,6.15,3,4,2,4,1,6,5,5,5,5,6,5,6,6,Rebel,"clone, berserker, regeneration, x-force_affiliated, trauma_survivor",https://res.cloudinary.com/dvncqcife/image/upload/v1741319395/Wolverine_X-23_smdne1.png,TRUE
Master_Roster,T006,F164,P164,Wolverine,Pigeon Desk,Overlay,"FL, RG, VG, EN, GO",Physical Combatants (PC),martial_arts_master,Martial Arts Master,GRD,grounded,6.29,2,4,2,4,1,7,5,7,7,3,6,5,5,7,Cynic,"regeneration, berserker, claws, x-men_affiliated, loner",https://res.cloudinary.com/dvncqcife/image/upload/v1741318326/Wolverine_qp3cqw.png,TRUE
Master_Roster,T006,F165,P165,Wonder Man,Pigeon Desk,Overlay,"RG, VG, EN, SV",Cosmic & Reality (CR),brawler,Brawler,"FLY, HVR","fly, hover",5.63,3,6,5,6,1,4,5,6,6,6,5,4,5,5,Idealist,"ionic_energy, celebrity, strength_based, avengers_affiliated, conflicted",https://res.cloudinary.com/dvncqcife/image/upload/v1741318327/Wonder_Man_xszf9p.png,TRUE
Master_Roster,T007,F166,P166,Xorn,Agents of Vishanti,Overlay,"EN, PO, SV",Mystic Adept (MA),cosmic_entity,Cosmic Entity,"FLY, HVR","fly, hover",6.77,3,4,3,6,6,4,5,5,5,5,5,7,6,4,Cosmic Observer,"black_hole_head, healer, cosmic_potential, x-men_affiliated, identity_shift",https://res.cloudinary.com/dvncqcife/image/upload/v1741318328/Xorn_k7rhmm.png,TRUE
Master_Roster,Free Agent,F167,P167,Yondu,unaffiliated,unaffiliated,"RG, VG, GO",Physical Combatants (PC),mystic_practitioner,Mystic Arts Practitioner,GRD,grounded,3.44,2,2,2,2,1,5,4,4,5,4,4,3,5,5,Outsider,"whistle_weapon, mercenary, cosmic, guardian_affiliated, archer",https://res.cloudinary.com/dvncqcife/image/upload/v1741318328/Yondu_ljoajc.png,TRUE